query,n_relevant,P@5,R@5,F1@5,nDCG@5,P@10,R@10,F1@10,nDCG@10,MRR,MAP
natural language processing text classification,5,0.4,0.4,0.4,0.5706,0.5,1.0,0.6667,0.6565,0.3333,0.506
reinforcement learning policy reward agent,7,1.0,0.7143,0.8333,1.0,0.6,0.8571,0.7059,0.9877,1.0,0.8214
support vector machine kernel classification,8,1.0,0.625,0.7692,1.0,0.5,0.625,0.5556,1.0,1.0,0.625
neural network deep learning representation,6,0.8,0.6667,0.7273,0.9047,0.5,0.8333,0.625,0.9068,1.0,0.675
bayesian probabilistic graphical model,5,1.0,1.0,1.0,1.0,0.5,1.0,0.6667,1.0,1.0,1.0
